{
  "$schema": "https://json-schema.org/draft/2020-12/schema",
  "additionalProperties": false,
  "properties": {
    "assets_sha256": {
      "pattern": "^[0-9a-f]{64}$",
      "type": "string"
    },
    "backend_module_inventory_sha256": {
      "pattern": "^[0-9a-f]{64}$",
      "type": "string"
    },
    "compatible_receipt_sha256": {
      "pattern": "^[0-9a-f]{64}$",
      "type": "string"
    },
    "corrected_plan_sha256": {
      "pattern": "^[0-9a-f]{64}$",
      "type": "string"
    },
    "correction_overlay_sha256": {
      "pattern": "^[0-9a-f]{64}$",
      "type": "string"
    },
    "delivery_commit": {
      "const": "e40b9ff240ce97af0c03ac254b52a8af084634bd"
    },
    "historical_receipt_sha256": {
      "pattern": "^[0-9a-f]{64}$",
      "type": "string"
    },
    "images": {
      "additionalProperties": false,
      "properties": {
        "backend": {
          "additionalProperties": false,
          "properties": {
            "corrected_id": {
              "pattern": "^sha256:[0-9a-f]{64}$",
              "type": "string"
            },
            "original_id": {
              "pattern": "^sha256:[0-9a-f]{64}$",
              "type": "string"
            }
          },
          "required": [
            "original_id",
            "corrected_id"
          ],
          "type": "object"
        },
        "frontend": {
          "additionalProperties": false,
          "properties": {
            "corrected_id": {
              "pattern": "^sha256:[0-9a-f]{64}$",
              "type": "string"
            },
            "original_id": {
              "pattern": "^sha256:[0-9a-f]{64}$",
              "type": "string"
            }
          },
          "required": [
            "original_id",
            "corrected_id"
          ],
          "type": "object"
        }
      },
      "required": [
        "backend",
        "frontend"
      ],
      "type": "object"
    },
    "original_plan_sha256": {
      "pattern": "^[0-9a-f]{64}$",
      "type": "string"
    },
    "qualification": {
      "const": "diagnostic-build-only"
    },
    "role": {
      "enum": [
        "A",
        "C"
      ]
    },
    "runtime_authorized": {
      "const": false
    },
    "schema": {
      "const": "perf391-corrected-image-receipt-v2"
    },
    "source_commit": {
      "const": "31b1fbbfded503344e9df653ba148850a2e69f95"
    }
  },
  "required": [
    "assets_sha256",
    "backend_module_inventory_sha256",
    "compatible_receipt_sha256",
    "corrected_plan_sha256",
    "correction_overlay_sha256",
    "delivery_commit",
    "historical_receipt_sha256",
    "images",
    "original_plan_sha256",
    "qualification",
    "role",
    "runtime_authorized",
    "schema",
    "source_commit"
  ],
  "type": "object"
}
